{
    "average_ite": 0.10401011917788924,
    "median_ite": 0.10128640893092995,
    "positive_ite_share": 0.9539290785815716,
    "top_positive_ite": 0.5577649589176255,
    "top_negative_ite": -0.1879077638523005,
    "mae": 0.07884215747314655,
    "rmse": 0.09422683514771418,
    "correlation": 0.503985684534795,
    "qini_coefficient": 0.46813552347740955,
    "n_customers": 99998
}